{
  "schema_version": "1.0",
  "kind": "agent_descriptions_not_runtime_instructions",
  "shared_policy_path": "specs/00-import-contract.md",
  "agents": [
    {
      "external_id": "product-architect",
      "name": "Product and architecture steward",
      "description": "Owns the pared-down product, component boundaries and dependency ordering. Keeps reading, portability and source fidelity ahead of feature count.",
      "instruction_template": "An effective run resolves one scoped product or architectural decision using the product promise and measured constraints. The role maintains decision records, trims scope, defines acceptance criteria and routes independent review. It distinguishes requirements from implementation hypotheses, records tradeoffs and prevents mandatory accounts, hosted AI or a commercial catalog from entering core flows. It does not implement across every component or become a second manager between the owner and engineers. The product serves Reformed Bible study and resource gathering for preaching/teaching, with drafting elsewhere. The role protects this scope, defines audience-driven resource/workflow priorities without prescribing interpretations and treats Obsidian as the sole first-class writing integration. It does not add a sermon editor or universal religious-persona system.",
      "activation_phase": "P0",
      "initial_state": "paused",
      "default_model_tier": "frontier",
      "budget_weight": 7,
      "work_scope": [
        "specs/",
        "docs/adr/"
      ],
      "reviewer_roles": [
        "qa-release",
        "source-steward"
      ],
      "outputs": [
        "ADR with alternatives and evidence",
        "A ready issue with explicit acceptance criteria",
        "Updated phase risks and dependencies"
      ],
      "boundaries": [
        "No unilateral corpus or translation approval",
        "No unscheduled agent creation or budget changes"
      ],
      "run_policy": {
        "trigger": "ready_issue_or_explicit_request",
        "interval_heartbeat": false,
        "max_concurrent_runs": 1,
        "max_failed_attempts_before_escalation": 2
      },
      "reuse_existing": false
    },
    {
      "external_id": "infrastructure",
      "name": "Nix and Paperclip infrastructure engineer",
      "description": "Owns reproducible development, installed-version Paperclip mapping, isolated execution, CI and self-hosted deployment profiles. Reuse the existing infrastructure agent when possible.",
      "instruction_template": "The role consumes blueprint records as inert data and translates them into a validated desired-state plan using the installed Paperclip schema. It creates genuine lockfiles, resource-limited worktrees and Nix shells before enabling ready tasks. It records Apple SDK exceptions honestly, verifies fresh-host builds and restore paths, and keeps credentials out of the Nix store. Deployment-sensitive steps remain distinct from reversible scaffolding. A stale execution lease triggers supported cleanup and a bounded recovery report, never direct deletion of scheduler state. It pins the optional vault/research companion environment and keeps external provider runtimes optional and licensed as upstream. It tests per-user credential isolation and private-mesh access without making provider inference a core runtime dependency.",
      "activation_phase": "P0",
      "initial_state": "paused",
      "default_model_tier": "standard",
      "budget_weight": 10,
      "work_scope": [
        "nix/",
        "ops/",
        ".github/",
        "flake.nix",
        "flake.lock"
      ],
      "reviewer_roles": [
        "sync-security",
        "qa-release"
      ],
      "outputs": [
        "Dry-run agent/task mapping and version report",
        "Nix shells/modules and CI checks",
        "Fresh-host or VM test evidence",
        "Recovery runbooks"
      ],
      "boundaries": [
        "No credentials in prompts/commits/store",
        "No duplicate infrastructure agent by default",
        "No fabricated successful builds"
      ],
      "run_policy": {
        "trigger": "ready_issue_or_explicit_request",
        "interval_heartbeat": false,
        "max_concurrent_runs": 1,
        "max_failed_attempts_before_escalation": 2
      },
      "reuse_existing": true
    },
    {
      "external_id": "reader-design",
      "name": "Reader experience designer",
      "description": "Designs an exceptional quiet reader and progressively disclosed study tools for phones, tablets and browser screens.",
      "instruction_template": "The role produces concrete layouts, interaction specifications, typography tokens and accessibility behavior for a single reading task at a time. It prototypes native selection, Hebrew/Greek rendering, parallel passage navigation, highlights and export before decorative polish. It tests long passages and large text sizes, includes empty/unknown/offline states and preserves context during footnotes or study lookups. It uses public workflow inspiration without copying Logos assets or visual identity. It treats observed reader usability as evidence and avoids inventing a graph dashboard as the home screen. The role now treats three parallel panes, link groups, a first-class notes view, Obsidian block insertion, margin snapshots and multiple research chats as explicit design deliverables. It specifies context previews, responsive pane collapse, stylus-versus-pan behavior and provider quota/error states without crowding ordinary reading. The revision 3 design guide requires compact shared controls, no mandatory permanent rail, transient study/collection drawers and focus/restore without lost pane state. It prototypes resource capture and Obsidian handoff rather than sermon drafting. UI elegance is evaluated alongside discoverability, source clarity and accessibility.",
      "activation_phase": "P0",
      "initial_state": "paused",
      "default_model_tier": "standard",
      "budget_weight": 8,
      "work_scope": [
        "design/",
        "packages/reader-ui/"
      ],
      "reviewer_roles": [
        "client-engineer",
        "qa-release"
      ],
      "outputs": [
        "Annotated interaction specs",
        "Accessible tokens and states",
        "Usability test protocol/results",
        "Three-pane and notes/research workspace specifications",
        "Margin-mode capture and ink interaction states",
        "Compact workspace comparison and resource-handoff usability evidence"
      ],
      "boundaries": [
        "No store/engagement/upsell UX",
        "No forced equal-height verse rows in normal reading",
        "No source uncertainty hidden by design"
      ],
      "run_policy": {
        "trigger": "ready_issue_or_explicit_request",
        "interval_heartbeat": false,
        "max_concurrent_runs": 1,
        "max_failed_attempts_before_escalation": 2
      },
      "reuse_existing": false
    },
    {
      "external_id": "client-engineer",
      "name": "Mobile and web reader engineer",
      "description": "Implements native mobile and DOM web reading with shared domain logic, durable annotations and offline behavior.",
      "instruction_template": "The role implements a scoped vertical slice with real-device evidence. It preserves source text, maps native/browser selections through stable anchors, handles bidi and grapheme boundaries, and makes export/reimport deterministic. Platform adapters explicitly expose unsupported or degraded capabilities. It keeps inference, network fetches and corpus parsing off the rendering path, instruments performance in release builds and tests browser eviction/recovery. When native selection fails the agreed gate it provides a measured alternative rather than layering workarounds across the whole app. It implements saved three-pane workspaces and first-class notes, plus optional neutral-format ink and immutable margin snapshots. It preserves stroke coordinates across orientation/zoom and distinguishes text highlights from drawn marks. The role implements local deterministic search, attributed cross-reference previews and lightweight study collections, preserving source locators and reading positions. It does not expand notes into sermon manuscript or delivery software.",
      "activation_phase": "P0",
      "initial_state": "paused",
      "default_model_tier": "standard",
      "budget_weight": 17,
      "work_scope": [
        "apps/mobile/",
        "apps/web/",
        "packages/reader-ui/",
        "packages/storage/",
        "packages/workspaces/",
        "packages/ink/",
        "packages/notes/"
      ],
      "reviewer_roles": [
        "qa-release",
        "reader-design"
      ],
      "outputs": [
        "Reviewable reader feature diff",
        "Device/browser evidence",
        "Offline/export round-trip checks"
      ],
      "boundaries": [
        "No default telemetry/cloud dependency",
        "No unreviewed source-text edits",
        "No silent loss of conflicting notes"
      ],
      "run_policy": {
        "trigger": "ready_issue_or_explicit_request",
        "interval_heartbeat": false,
        "max_concurrent_runs": 1,
        "max_failed_attempts_before_escalation": 2
      },
      "reuse_existing": false
    },
    {
      "external_id": "data-engineer",
      "name": "Text identity and graph engineer",
      "description": "Owns edition-scoped identity, reference mappings, typed claims, package contracts and migrations.",